{
  "schemaVersion": 1,
  "scenarioId": "java-increment",
  "title": "같은 ++, 다른 순간",
  "summary": "전위와 후위 증가에서 값이 쓰이는 순간을 비교해 보세요.",
  "language": "java",
  "languageVersion": "17",
  "topic": "평가 순서 · 증감 연산",
  "executionKind": "curated_simulation",
  "preconditions": [
    "Java 17, 메서드 내부의 지역 변수",
    "단일 스레드, int 오버플로 없음",
    "각 단계는 표시한 문장이 완료된 직후의 상태"
  ],
  "code": "int a = 10;\nint b = a++;\nint c = ++a;",
  "visualization": {
    "type": "variables",
    "schemaVersion": 1,
    "fields": [
      { "name": "a", "type": "int" },
      { "name": "b", "type": "int" },
      { "name": "c", "type": "int" }
    ]
  },
  "steps": [
    {
      "id": 0,
      "line": null,
      "state": {},
      "explanation": "아직 문장을 평가하지 않았습니다. b와 c에 어떤 값이 담길지 먼저 예측해 보세요."
    },
    {
      "id": 1,
      "line": 1,
      "state": { "a": "10" },
      "explanation": "지역 변수 a를 선언하고 정수 10으로 초기화합니다."
    },
    {
      "id": 2,
      "line": 2,
      "state": { "a": "11", "b": "10" },
      "explanation": "a++의 표현식 값은 증가 전 값 10입니다. a는 11이 되고, b에는 표현식 값 10이 저장됩니다."
    },
    {
      "id": 3,
      "line": 3,
      "state": { "a": "12", "b": "10", "c": "12" },
      "explanation": "++a는 a를 먼저 12로 증가시킵니다. 표현식 값도 12이므로 c에 12가 저장됩니다. b는 10 그대로입니다."
    }
  ],
  "review": {
    "question": "모든 문장이 끝난 뒤 b와 c의 값은 무엇일까요?",
    "options": [
      { "id": "a", "text": "b = 11, c = 12" },
      { "id": "b", "text": "b = 10, c = 12" },
      { "id": "c", "text": "b = 10, c = 11" }
    ],
    "answer": "b",
    "rationale": "후위 증가 a++는 증가 전 값을 돌려주므로 b는 10입니다. 그 뒤 a는 11이며, 전위 증가 ++a는 증가 후 값 12를 돌려주므로 c는 12입니다. 표현식의 값과 변수의 최종 값을 구분하는 것이 핵심입니다."
  },
  "verification": {
    "method": "runtime_test",
    "reference": "tests/runtime/scenarios.test.mjs#java-increment",
    "sources": [
      "https://docs.oracle.com/javase/specs/jls/se17/html/jls-15.html#jls-15.14.2",
      "https://docs.oracle.com/javase/specs/jls/se17/html/jls-15.html#jls-15.15.1"
    ]
  }
}
